{
  "vct": "eu.we-build:companyinfo:1",
  "iss": "https://issuer.example.com",
  "iat": 1736935200,
  "exp": 1768471200,
  "issuing_entity": "did:example:legal-entity-123",
  "attestation_legal_category": "EAA",
  "schema_version": "1.0",
  "cnf": {
    "jwk": {
      "kty": "EC",
      "crv": "P-256",
      "x": "TCAER19Zvu3OHF4j4W4vfSVoHIP1ILilDls7vCeGemc",
      "y": "ZxjiWWbZMQGHVWKVQ4hbSIirsVfuecCE6t4jT9F2HZQ"
    }
  },
  "status": {
    "type": "status-list",
    "status_list_credential": "https://issuer.example.com/status/companyinfo/2025",
    "status_list_index": 123,
    "status_purpose": "revocation"
  },
  "legal_entity": {
    "legal_person": {
      "legal_person_name": "Example GmbH",
      "legal_form_type": "GmbH"
    },
    "identifier": {
      "euid": "DE1212.HRB123456",
      "tax": "DE123456789"
    }
  },
  "number_of_employees": "1250",
  "trade_alias": [
    "BuildCo",
    "WeBuild Solutions"
  ],
  "previous_legal_name": [
    "Former Company Name GmbH"
  ],
  "financial_statements": {
    "taxonomy": "IFRS",
    "facts": [
      {
        "id": "fact-001",
        "concept": "Revenue",
        "value": 45000000.0,
        "unit": "EUR",
        "period_start": "2024-01-01",
        "period_end": "2024-12-31"
      },
      {
        "id": "fact-002",
        "concept": "NetIncome",
        "value": 3200000.0,
        "unit": "EUR",
        "period_start": "2024-01-01",
        "period_end": "2024-12-31"
      }
    ]
  }
}